{
  "$schema": "https://raw.githubusercontent.com/Mikefluff/skills/main/docs/skills.schema.json",
  "collection": "Mikefluff/skills",
  "version": "2.24.0",
  "repo": "https://github.com/Mikefluff/skills",
  "license": "MIT",
  "skills": [
    {
      "name": "audio-mix-maker",
      "dir": "skills/audio-mix-maker",
      "layer": "wrapper",
      "description": "Mix a music / audio track onto an existing video via ffmpeg. Three modes: replace (drop original audio), overlay (mix both audible), duck (sidechain compressor lowers music when speech detected). Volume + fade controls. No API calls — pure ffmpeg.",
      "languages": [
        "en",
        "ru"
      ],
      "tags": [
        "audio",
        "editing"
      ],
      "deps": []
    },
    {
      "name": "avatar-maker",
      "dir": "skills/avatar-maker",
      "layer": "orchestrator",
      "description": "Turn a user photo into N profile-pic / headshot / avatar variants in a consistent style. Wraps image-prompt --execute + the carousel style library + the runner's batch executor. Identity preserve is THE differentiator — defaults to nano-banana-pro for best face preservation. Multi-aspect output (square 1:1, square-tight, cover 4:5, story 9:16, wide 16:9). Outputs: ./generated/avatar/<slug>/<aspect>-v<N>.png + manifest.json.",
      "languages": [
        "en",
        "ru"
      ],
      "tags": [
        "visual",
        "generation",
        "orchestration"
      ],
      "deps": [
        "image-prompt"
      ]
    },
    {
      "name": "banner-maker",
      "dir": "skills/banner-maker",
      "layer": "orchestrator",
      "description": "Banner-ad / display-creative generator with standard-size presets — Google Display (leaderboard, medium-rectangle, mobile-banner, wide-skyscraper), OG image, LinkedIn ad, Facebook ad, Twitter card. Headline + CTA + brand composition. Default model ideogram-3-quality for clean embedded text. Outputs: ./generated/banner/<slug>/<preset>.png + manifest.json.",
      "languages": [
        "en",
        "ru"
      ],
      "tags": [
        "visual",
        "marketing",
        "generation",
        "orchestration"
      ],
      "deps": [
        "image-prompt"
      ]
    },
    {
      "name": "bg-remover",
      "dir": "skills/bg-remover",
      "layer": "wrapper",
      "description": "Background removal utility — image in, transparent PNG out. Wraps Replicate-hosted background removal models (851-labs/background-remover by default). Single image input, transparent PNG output. ~$0.001-0.005 per image.",
      "languages": [
        "en",
        "ru"
      ],
      "tags": [
        "visual",
        "editing"
      ],
      "deps": []
    },
    {
      "name": "canon-check",
      "dir": "skills/canon-check",
      "layer": "linter",
      "description": "Story-bible consistency auditor for any book series. Greps entities (characters / artifacts / locations) in changed chapters, cross-references the project's story-bible document, flags BLOCKING contradictions / WARNING gaps / INFO new details. Read-only — trust the text, not memory.",
      "languages": [
        "ru",
        "en"
      ],
      "tags": [
        "fiction",
        "audit"
      ],
      "deps": []
    },
    {
      "name": "carousel-builder",
      "dir": "skills/carousel-builder",
      "layer": "orchestrator",
      "description": "Turn a topic or research brief into an N-slide Instagram / LinkedIn / TikTok carousel with consistent visual style and ready-to-post captions. Wraps essay-write + viral-text + image-prompt --execute + common style library (24 visual styles). Outputs PNG slides + captions.md + manifest. Modes: --topic / --research; --style auto|<library-id>|--style-ref <image>; --slides 3-12; --platform instagram|linkedin|tiktok; --text-mode embedded|overlay|none; --execute; --resume.",
      "languages": [
        "en",
        "ru"
      ],
      "tags": [
        "visual",
        "marketing",
        "generation",
        "orchestration"
      ],
      "deps": [
        "image-prompt",
        "viral-text",
        "essay-write"
      ]
    },
    {
      "name": "cold-email",
      "dir": "skills/cold-email",
      "layer": "wrapper",
      "description": "Write or rewrite cold outreach emails (first-touch, follow-up, intro request, re-engage). 5-block structure, ≤120-word budget, banned ceremony patterns, anti-template subject lines. Wraps writer as final cleanup.",
      "languages": [
        "en",
        "ru"
      ],
      "tags": [
        "outreach",
        "generation"
      ],
      "deps": [
        "writer"
      ]
    },
    {
      "name": "cover-maker",
      "dir": "skills/cover-maker",
      "layer": "orchestrator",
      "description": "Turn cover metadata (title / creator / subtitle / medium) into an album / book / podcast / report / deck / magazine cover. Wraps image-prompt --execute + the carousel style library (24 visual styles) + the runner's batch executor. Picks aspect by medium. Multi-variant output. Optional photo / artwork reference. Outputs: ./generated/cover/<slug>/<medium>.png + manifest.json.",
      "languages": [
        "en",
        "ru"
      ],
      "tags": [
        "visual",
        "marketing",
        "generation",
        "orchestration"
      ],
      "deps": [
        "image-prompt"
      ]
    },
    {
      "name": "essay-write",
      "dir": "skills/essay-write",
      "layer": "wrapper",
      "description": "Non-fiction layer — long subordinate sentences (Manson style), source-backed claims, philosophy through humor, biography through scenes, plain-Russian for complex content.",
      "languages": [
        "ru"
      ],
      "tags": [
        "non-fiction",
        "generation"
      ],
      "deps": [
        "writer"
      ]
    },
    {
      "name": "flyer-maker",
      "dir": "skills/flyer-maker",
      "layer": "orchestrator",
      "description": "Turn event details (title / date / location / CTA) plus an optional photo into a poster/flyer/social-event-graphic with embedded text in a chosen visual style. Wraps image-prompt --execute + the carousel style library (24 visual styles) + the runner's batch executor. Picks a text-friendly + multi-ref-capable model (gpt-image-2 / ideogram-3-quality / nano-banana-pro). Multi-aspect output (portrait / square / story / landscape / a4). Outputs: ./generated/flyer/<event-slug>/<aspect>.png + manifest.json + prompts.md.",
      "languages": [
        "en",
        "ru"
      ],
      "tags": [
        "visual",
        "marketing",
        "generation",
        "orchestration"
      ],
      "deps": [
        "image-prompt"
      ]
    },
    {
      "name": "gif-maker",
      "dir": "skills/gif-maker",
      "layer": "wrapper",
      "description": "Short looping GIF utility. Mode A: convert existing MP4 → GIF via ffmpeg 2-pass palette optimization. Mode B: generate 1-3s clip via a video provider (Veo / Kling / fal-video / Sora) then convert. Aspect crop presets (1:1 / 9:16 / 16:9 / 4:5 / 2:1). Outputs: ./generated/gif/<name>.gif.",
      "languages": [
        "en",
        "ru"
      ],
      "tags": [
        "visual",
        "generation",
        "editing"
      ],
      "deps": [
        "video-prompt"
      ]
    },
    {
      "name": "image-prompt",
      "dir": "skills/image-prompt",
      "layer": "wrapper",
      "description": "Write prompts for 14+ frontier AI image generators (Midjourney V8.1, Flux 2 / Flux Kontext, Nano Banana Pro / 2 / 2 Lite (Gemini image family), gpt-image-2, Ideogram 4 / 3, Recraft V3, Seedream 5.0, Qwen-Image, HiDream-O1, Krea-1, SD 3.5, SDXL). Modes: text-to-image, edit (preserve/change), multi-reference, text-in-image. 6-part formula + per-model deltas, character/identity locks, weighted multi-ref.",
      "languages": [
        "en",
        "ru"
      ],
      "tags": [
        "visual",
        "generation"
      ],
      "deps": []
    },
    {
      "name": "landing-copy",
      "dir": "skills/landing-copy",
      "layer": "wrapper",
      "description": "Write marketing copy — landing page sections (hero/features/pricing/FAQ), SEO meta (title+description+OG+Twitter), ad copy (Google/Facebook/LinkedIn/X). Julian Shapiro hero formula, char limits per platform. Wraps writer.",
      "languages": [
        "en",
        "ru"
      ],
      "tags": [
        "marketing",
        "generation"
      ],
      "deps": [
        "writer"
      ]
    },
    {
      "name": "logo-maker",
      "dir": "skills/logo-maker",
      "layer": "orchestrator",
      "description": "Brand mark / wordmark / logo generator. Defaults to ideogram-3-quality (cleanest embedded text). Six style presets (wordmark / minimal / illustrated / typographic / geometric / emblem) + optional palette hint. Single-image output, N stochastic variants per call. Outputs: ./generated/logo/<slug>/logo-v<N>.png + manifest.json.",
      "languages": [
        "en",
        "ru"
      ],
      "tags": [
        "visual",
        "marketing",
        "generation",
        "orchestration"
      ],
      "deps": [
        "image-prompt"
      ]
    },
    {
      "name": "meme-card-maker",
      "dir": "skills/meme-card-maker",
      "layer": "orchestrator",
      "description": "Meme-format graphic generator — top text + bottom text + optional centerpiece image. Wraps image-prompt --execute with Impact-style typography (bold white text + thick black stroke). Supports 5 template hints (drake / distracted-boyfriend / expanding-brain / two-buttons / change-my-mind) + custom mode. Optional --base-photo for user-image centerpiece. Default model gpt-image-2. Outputs: ./generated/meme/<slug>/meme-v<N>.png + manifest.json.",
      "languages": [
        "en",
        "ru"
      ],
      "tags": [
        "visual",
        "marketing",
        "generation",
        "orchestration"
      ],
      "deps": [
        "image-prompt"
      ]
    },
    {
      "name": "microcopy",
      "dir": "skills/microcopy",